{
  "id": "enea-g11-2026",
  "name": "Enea Operator — Taryfa G11",
  "dso": "ENEA Operator Sp. z o.o.",
  "tariff_group": "G11",
  "valid_from": "2026-01-01",
  "valid_to": null,
  "version": "2026",
  "currency": "PLN",
  "source_url": "https://operator.enea.pl/dla-domu/taryfy",
  "notes": "Taryfa zatwierdzona decyzją Prezesa URE nr DRE.WRE.4211.52.11.2025.TG z dnia 17.12.2025 r. Obejmuje obszar: Wielkopolska, Kujawy, Lubuskie, Zachodniopomorskie. Stawka jakościowa 0,0331 zł/kWh od 01.01.2026; od 01.02.2026 wynosi 0,0332 zł/kWh (zmiana Taryfy OSP decyzją DRE.WPR.4211.1.4.2026.BTS).",

  "variable_rates_pln_kwh": {
    "type": "flat",
    "rate": 0.2456
  },

  "fixed_charges_monthly": {
    "subscription_pln": 3.84,
    "network_pln_1phase": 7.25,
    "network_pln_3phase": 10.14,
    "power_demand_pln_per_kw": 0.0
  },

  "capacity_monthly_pln": {
    "below_500kwh": 4.29,
    "500_to_1200kwh": 10.31,
    "1200_to_2800kwh": 17.18,
    "above_2800kwh": 24.05
  },

  "system_charges_pln_kwh": {
    "oze": 0.0073,
    "capacity": 0.0,
    "quality": 0.0331,
    "transition": 0.0,
    "cogeneration": 0.003
  },

  "excise_pln_kwh": 0.005,
  "vat_rate": 0.23
}
