{
  "id": "stoen-g11-2026",
  "name": "Stoen Operator — Taryfa G11",
  "dso": "Stoen Operator Sp. z o.o.",
  "tariff_group": "G11",
  "valid_from": "2026-01-01",
  "valid_to": null,
  "version": "2026",
  "currency": "PLN",
  "source_url": "https://www.stoen.pl/pl/strona/grupa-taryfowa-g",
  "notes": "Taryfa dla energii elektrycznej w zakresie dystrybucji Stoen Operator Sp. z o.o. obowiązuje od 01.01.2026 r. Obszar: Warszawa (miejski). Stawka jakościowa: 0,0331 zł/kWh w styczniu 2026; od 01.02.2026 wynosi 0,0332 zł/kWh.",

  "variable_rates_pln_kwh": {
    "type": "flat",
    "rate": 0.2342
  },

  "fixed_charges_monthly": {
    "subscription_pln": 2.88,
    "network_pln_1phase": 11.46,
    "network_pln_3phase": 18.53,
    "power_demand_pln_per_kw": 0.0
  },

  "capacity_monthly_pln": {
    "below_500kwh": 4.29,
    "500_to_1200kwh": 10.31,
    "1200_to_2800kwh": 17.18,
    "above_2800kwh": 24.05
  },

  "system_charges_pln_kwh": {
    "oze": 0.0073,
    "capacity": 0.0,
    "quality": 0.0331,
    "transition": 0.0,
    "cogeneration": 0.003
  },

  "excise_pln_kwh": 0.005,
  "vat_rate": 0.23
}
