{
  "id": "pge-g12-2026",
  "name": "PGE Dystrybucja — Taryfa G12",
  "dso": "PGE Dystrybucja S.A.",
  "tariff_group": "G12",
  "valid_from": "2026-01-01",
  "valid_to": null,
  "version": "2026",
  "currency": "PLN",
  "source_url": "https://pgedystrybucja.pl/dla-domu/taryfy",
  "notes": "Taryfa zatwierdzona decyzją Prezesa URE nr DRE.WRE.4211.50.7.2025.JTr z dnia 17.12.2025 r. UWAGA: PGE G12 ma sezonowe strefy! Zima (1.10–31.03): dzienna 06:00–13:00 i 15:00–22:00. Lato (1.04–30.09): dzienna 06:00–15:00 i 17:00–22:00. W pliku zastosowano harmonogram zimowy (bardziej niekorzystny). Stawka jakościowa od 01.02.2026 wynosi 0,0332 zł/kWh.",

  "variable_rates_pln_kwh": {
    "type": "tou",
    "periods": [
      {
        "name": "day",
        "label": "Dzienna",
        "rate": 0.4014,
        "schedule": {
          "weekday":  ["06:00-13:00", "15:00-22:00"],
          "saturday": ["06:00-13:00", "15:00-22:00"],
          "sunday":   [],
          "holiday":  []
        }
      },
      {
        "name": "night",
        "label": "Nocna",
        "rate": 0.0765,
        "schedule": {
          "weekday":  ["00:00-06:00", "13:00-15:00", "22:00-24:00"],
          "saturday": ["00:00-06:00", "13:00-15:00", "22:00-24:00"],
          "sunday":   ["00:00-24:00"],
          "holiday":  ["00:00-24:00"]
        }
      }
    ]
  },

  "fixed_charges_monthly": {
    "subscription_pln": 4.50,
    "network_pln_1phase": 8.50,
    "network_pln_3phase": 14.40,
    "power_demand_pln_per_kw": 0.0
  },

  "capacity_monthly_pln": {
    "below_500kwh": 4.29,
    "500_to_1200kwh": 10.31,
    "1200_to_2800kwh": 17.18,
    "above_2800kwh": 24.05
  },

  "system_charges_pln_kwh": {
    "oze": 0.0073,
    "capacity": 0.0,
    "quality": 0.0331,
    "transition": 0.0,
    "cogeneration": 0.003
  },

  "excise_pln_kwh": 0.005,
  "vat_rate": 0.23
}
