{
  "id": "tauron-g11-2026",
  "name": "Tauron Dystrybucja — Taryfa G11",
  "dso": "TAURON Dystrybucja S.A.",
  "tariff_group": "G11",
  "valid_from": "2026-01-01",
  "valid_to": null,
  "version": "2026",
  "currency": "PLN",
  "source_url": "https://www.tauron-dystrybucja.pl/taryfy",
  "notes": "Taryfa zatwierdzona decyzją Prezesa URE nr DRE.WRE.4211.54.8.2025.ASa1 z dnia 17.12.2025 r. Stawka jakościowa może ulec zmianie w trakcie roku wraz ze zmianą Taryfy OSP.",

  "variable_rates_pln_kwh": {
    "type": "flat",
    "rate": 0.2464
  },

  "fixed_charges_monthly": {
    "subscription_pln": 2.28,
    "network_pln_1phase": 7.38,
    "network_pln_3phase": 10.86,
    "power_demand_pln_per_kw": 0.0
  },

  "capacity_monthly_pln": {
    "below_500kwh": 4.29,
    "500_to_1200kwh": 10.31,
    "1200_to_2800kwh": 17.18,
    "above_2800kwh": 24.05
  },

  "system_charges_pln_kwh": {
    "oze": 0.0073,
    "capacity": 0.0,
    "quality": 0.0331,
    "transition": 0.0,
    "cogeneration": 0.003
  },

  "excise_pln_kwh": 0.005,
  "vat_rate": 0.23
}
