{
  "id": "pge-g11-2026",
  "name": "PGE Dystrybucja — Taryfa G11",
  "dso": "PGE Dystrybucja S.A.",
  "tariff_group": "G11",
  "valid_from": "2026-01-01",
  "valid_to": null,
  "version": "2026",
  "currency": "PLN",
  "source_url": "https://pgedystrybucja.pl/dla-domu/taryfy",
  "notes": "Taryfa zatwierdzona decyzją Prezesa URE nr DRE.WRE.4211.50.7.2025.JTr z dnia 17.12.2025 r. Obowiązuje od 01.01.2026 r. Tekst jednolity od 01.02.2026 uwzględnia zmianę stawki jakościowej do 0,0332 zł/kWh (decyzja DRE.WPR.4211.1.4.2026.BTS z dnia 16.01.2026 r.). Stawki jednolite dla wszystkich Oddziałów.",

  "variable_rates_pln_kwh": {
    "type": "flat",
    "rate": 0.3469
  },

  "fixed_charges_monthly": {
    "subscription_pln": 4.50,
    "network_pln_1phase": 5.50,
    "network_pln_3phase": 9.98,
    "power_demand_pln_per_kw": 0.0
  },

  "capacity_monthly_pln": {
    "below_500kwh": 4.29,
    "500_to_1200kwh": 10.31,
    "1200_to_2800kwh": 17.18,
    "above_2800kwh": 24.05
  },

  "system_charges_pln_kwh": {
    "oze": 0.0073,
    "capacity": 0.0,
    "quality": 0.0331,
    "transition": 0.0,
    "cogeneration": 0.003
  },

  "excise_pln_kwh": 0.005,
  "vat_rate": 0.23
}
